filename	text	duration	sampling_rate	speaker
khm_0308_0011865648.wav	ស្ពាន កំពង់ ចម្លង អ្នកលឿង នៅ ព្រៃវែង ជា ស្ពាន វែង ជាង គេ ក្នុង ព្រះ រាជាណាចក្រ កម្ពុជា	6.997	48000	0308
khm_0308_0032157149.wav	ភ្លើង កំពុង ឆាប ឆេះ ផ្ទះ ប្រជា ពលរដ្ឋ នៅ សង្កាត់ ឫស្សីកែវ	4.864	48000	0308
khm_0308_0038959268.wav	អ្នក សុំ ទាន ដេក ប្រកាច់ ម្នាក់ ឯង ក្បែរ ខ្លោងទ្វារ វត្ត ស្រះចក ផ្នែក ខាង កើត	5.888	48000	0308
khm_0308_0054635313.wav	ស្ករ ត្នោត ដែល មាន គុណភាព ល្អ ផលិត នៅ ខេត្ត កំពង់ស្ពឺ	4.352	48000	0308
khm_0308_0055735195.wav	ភ្នំបាខែង មាន កម្ពស់ តែ ចិត សិប ម៉ែត្រ សោះ	3.584	48000	0308
khm_0308_0104279731.wav	ពូ រ៉ឺម៉ក ពីរ ក្រុម បើក ឆាក ប្រយុទ្ធ យ៉ាង សាហាវ នៅ ម្ដុំ ផ្សារ ថ្មី	4.864	48000	0308
khm_0308_0222822061.wav	កំពត និង កែប គឺ ជា ទឹកដី មួយ ដែល ជាប់ នឹង សមុទ្រ	4.437	48000	0308
khm_0308_0351151115.wav	ចាប់ ពី រង្វង់មូល ស្តាត ចាស់ ដល់ ផ្សារ ច្បារអំពៅ	4.352	48000	0308
khm_0308_0410954155.wav	សមត្ថកិច្ច បិទ ផ្លូវ នៅ ស្ពាន ក្បាល ថ្នល់	3.328	48000	0308
khm_0308_0546676602.wav	ស្ពាន ប្រដឹស ត ភ្ជាប់ ទៅ ឆ្នេរ ខ្សាច់ ធម្មជាតិ កោះប៉ែន	4.693	48000	0308
khm_0308_0776983860.wav	ហើយ ក៏ រាយការណ៍ ប្រាប់ ទៅ នគរបាល ប៉ុស្តិ៍ រដ្ឋបាល ស្រះចក	4.779	48000	0308
khm_0308_0794692022.wav	ប៉ា គេ លេង បាល់ នៅ ស្តាត អូឡាំពិក	3.243	48000	0308
khm_0308_0839590797.wav	ស្ត្រី ក្រុង ច្បារមន បើក កិច្ច ប្រជុំ ផ្សព្វផ្សាយ ផែនការ ថ្មី	4.693	48000	0308
khm_0308_0851797397.wav	ជន ជាតិ ដើម ភាគ តិច ព្នង ខេត្ត មណ្ឌល គិរី គ្រោង តវ៉ា	4.864	48000	0308
khm_0308_0857317195.wav	កំពង់ត្រាច សម្បូរ ទៅ ដោយ ល្អាង ភ្នំ មិន ចាញ់ បរទេស	4.011	48000	0308
khm_0308_0915697904.wav	ខុនដូ ថ្មី មួយ ទៀត នឹង សាងសង់ នៅ បឹង កេងកង មួយ	4.096	48000	0308
khm_0308_0921092662.wav	អ្នក ភូមិ ក្នុង សង្កាត់ សាមគ្គី ខេត្ត ស្ទឹងត្រែង ត្អូញត្អែរ ខ្វះ កន្លែង ធ្វើ បុណ្យ	5.547	48000	0308
khm_0308_0935331837.wav	មហា វិថី ព្រះ ស៊ីសុវត្ថិ ទល់ មុខ កំពង់ផែ ភ្នំពេញ	4.437	48000	0308
khm_0308_0968225593.wav	គេ កំពុង ជួសជុល ប្រាសាទ បាយ័ន	3.499	48000	0308
khm_0308_1016909228.wav	អនុស្សាវរីយ៍ ទីលាន ប្រជាធិបតេយ្យ	3.328	48000	0308
khm_0308_1058616340.wav	ឆេះ ផ្ទះ នៅ ជិត ភូមិ សាមគ្គី ផ្លូវ ជាតិ លេខ ប្រាំ	4.437	48000	0308
khm_0308_1074998143.wav	រថយន្ត សាមុយ គ្លីនិក ច្បារអំពៅ បុក ម៉ូតូ គុប ជ្រុង របួស ធ្ងន់	5.035	48000	0308
khm_0308_1214631802.wav	ក្រោយ ពី ដើរ បិណ្ឌបាត្រ រួច ដល់ ម៉ោង ឆាន់ ពួក គេ ទាំង ពីរ នាក់ បាន ទៅ រក វត្ត នាគវ័ន្ត ដើម្បី ស្នាក់ អាស្រ័យ បណ្តោះអាសន្ន	9.216	48000	0308
khm_0308_1254895494.wav	ទៅ ដល់ មុខ សណ្ឋាគារ កាំបូឌីយ៉ាណា ទើប ឈប់	3.755	48000	0308
khm_0308_1317136377.wav	មេ ព្រៃ នៅ ឧដុង្គ និយាយ ថា មិន បាន យក លុយ ឈើ ទេ	5.376	48000	0308
khm_0308_1324416656.wav	កម្មករ រោងចក្រ ប៊ីយូធីហ៊្វូល នៅ បាវិត បន្ត ធ្វើ កូដកម្ម	5.291	48000	0308
khm_0308_1407652655.wav	ស្ពាន ជ្រោយចង្វា ថ្មី បាន បើក ការដ្ឋាន សាងសង់ នៅ ព្រឹក នេះ	5.035	48000	0308
khm_0308_1535164858.wav	សហគមន៍ នៅ ឧត្តរមានជ័យ អំពាវនាវ ឱ្យ រដ្ឋាភិបាល ជួយ ការពារ ដី ព្រៃ	5.717	48000	0308
khm_0308_1550099120.wav	វត្ត បទុម ឬ ហៅ ម្យ៉ាង ទៀត ថា វត្ត ខ្ពបតាយ៉ង	4.352	48000	0308
khm_0308_1647381184.wav	អភិបាល រង ខេត្ត កោះកុង	2.645	48000	0308
khm_0308_1937492044.wav	ប្រវត្តិ របស់ ស្រុក បាភ្នំ នៅ ខេត្ត ព្រៃវែង	3.669	48000	0308
khm_0308_1953618232.wav	រថយន្ត សាំងយ៉ុង ដឹក អ្នក ដំណើរ ចេញ ពី ស្រុក សៀមប៉ាង មក ខេត្ត ស្ទឹងត្រែង ចំនួន បី គ្រឿង បន្លំ ដឹក ឈើ ប្រណិត	8.192	48000	0308
khm_0308_2038514460.wav	ប្រាសាទ តាព្រហ្ម ទន្លេ បាទី ជា មន្ទីរ ពេទ្យ បុរាណ នា សម័យ ព្រះ បាទ ជ័យវរ្ម័ន ទី ប្រាំពីរ	7.083	48000	0308
khm_0308_2048773496.wav	ស្វាយអន្ទរ នៅ ក្នុង ខេត្ត ណា	2.645	48000	0308
khm_0308_2122927324.wav	អ្នក ភូមិ បឹងកក់ កំពុង យំ ស្រែក ទាមទារ សំណង សមរម្យ	4.181	48000	0308
khm_0308_2231221883.wav	និយាយ ពី ភ្នំ សន្ទុក សឹង ស្រក់ ទឹក មាត់ ភ្លាម តែម្ដង នឹក ឃើញ មាន់ ដុត ក្តៅ ក្ដៅ ដែល ល្បី ស្ទើរ ពេញ ទាំង ខេត្ត	7.509	48000	0308
khm_0308_2253945901.wav	សំរាម នៅ លើ កំណាត់ មហា វិថី វេងស្រេង	4.267	48000	0308
khm_0308_2293177758.wav	តើ ពាក្យ ចតុមុខ សំដៅ ទៅ លើ អ្វី	3.157	48000	0308
khm_0308_2323178423.wav	ត្រង់ ចំណុច ផ្លូវ ទំនប់ ខ្មែរ លើ តាម បណ្ដោយ ផ្លូវ ជាតិ ប្រាំមួយ អា ស្ថិត ក្នុង ភូមិ គៀនឃ្លាំង	6.571	48000	0308
khm_0308_2454882696.wav	មុខរបរ ចិញ្ចឹម ដង្កូវនាង នៅ កោះ ឧកញ៉ាតី	4.181	48000	0308
khm_0308_2509413682.wav	ចំការ ស្នេហ៍ មាន បុគ្គលិក ដ៏ រួសរាយ រាក់ទាក់ ចាំ ទទួល	4.267	48000	0308
khm_0308_2558016039.wav	បុរស ម្នាក់ ដេក ស្លាប់ នៅ ជិត វត្ត តាំង ក្រសាំង	4.011	48000	0308
khm_0308_2582013291.wav	ក្មេង ប្រុស អាយុ ប្រាំមួយ ឆ្នាំ ជិះ កង់ ធ្លាក់ ទឹក ទន្លេ បាសាក់	4.352	48000	0308
khm_0308_2652788495.wav	វត្ត ខ្លះ ក្នុង ខេត្ត ព្រះវិហារ ខ្សត់ខ្សោយ ចង្ហាន់ នៅ រដូវ កាន់ បិណ្ឌ	5.12	48000	0308
khm_0308_2680464831.wav	ជួប គ្នា ស្អែក ម៉ោង ប្រាំពីរ ព្រឹក នៅ សួន វត្ត បទុម ទាំង អស់ គ្នា	4.779	48000	0308
khm_0308_2724707299.wav	ផ្អើល អស់ អ្នក រស់នៅ ត្រើយ ខាង កើត ស្ពាន ជ្រោយចង្វារ	4.181	48000	0308
khm_0308_2794454505.wav	នៅ មុខ មន្ទីរពេទ្យ ពេទ្យ កាល់ម៉ែត	2.475	48000	0308
khm_0308_2824667655.wav	សាខា កាំកុងត្រូល ខេត្ដ មណ្ឌល គិរី បាន ចុះ ត្រួត ពិនិត្យ	4.181	48000	0308
khm_0308_2837765884.wav	ជប៉ុន ធ្វើ គម្រោង ទេសចរណ៍ ប្លែក ប្លែក លើ ផ្ទៃ ដី ប្រាំពីរ រយ ហិកតា នៅ ឧទ្យាន គិរីរម្យ	6.571	48000	0308
khm_0308_2872359114.wav	ព្រះ បាទ ជ័យវរ្ម័ន ទី ប្រាំពីរ បាន កសាង ប្រាសាទ បាយ័ន នៅ ឆ្នាំ មួយ ពាន់ ពីរ រយ	6.229	48000	0308
khm_0308_2970778153.wav	នៅ ក្នុង អាណាចក្រ ព្រៃវែង បើ ឡាន ឈើ មិន ក្រឡាប់ សមត្ថកិច្ច សម្ងំ ឈឹង	5.888	48000	0308
khm_0308_2974572228.wav	ឱ្យ ជីក ព្រែក ទម្លាយ ទឹក ពី បឹង ពោងពាយ មក	4.096	48000	0308
khm_0308_3021411248.wav	ផ្ទុះ កំប៉ុង ហ្គាស របួស សង្ឃ ប្រាំពីរ អង្គ នៅ ស្រុក សំរោង	4.608	48000	0308
khm_0308_3139742730.wav	ទឹក ជំនន់ ទន្លេ មេគង្គ នៅ ស្រុក កៀនស្វាយ	3.669	48000	0308
khm_0308_3148513921.wav	មជ្ឈមណ្ឌល បណ្ដុះបណ្ដាល វិជ្ជា ជីវៈ ដុនបូស្កូ	4.352	48000	0308
khm_0308_3156122691.wav	បើក រថយន្ត មក ចត នៅ ក្បែរ ស្តុប ទេព ផន	3.925	48000	0308
khm_0308_3178423391.wav	លោក អះអាង ថា ប៉ូលិស ស្រុក អារញ្ញ ប្រទេស ថៃ	3.755	48000	0308
khm_0308_3208871049.wav	អាយ អេហ្វ អិល ប្រជុំ ដោយ អ្នក ខ្លាំង ខ្លាំង ខាង ភាសា	4.096	48000	0308
khm_0308_3241001667.wav	កម្ពុជា រៀបចំ បុណ្យ សមុទ្រ នៅ ខេត្ត កែប	3.499	48000	0308
khm_0308_3361247987.wav	ក្រឡឹង ផ្សារ អូឡាំពិក ពីរ ជុំ ទើប រក ហាង ហ្នឹង ឃើញ	4.523	48000	0308
khm_0308_3456512931.wav	ប្រសព្វ រវាង មហា វិថី សហព័ន្ធ រុស្ស៊ី មហា វិថី ម៉ៅសេទុង និង មហា វិថី គីមអ៊ីលស៊ុង	6.741	48000	0308
khm_0308_3503209135.wav	ចេញ ពី ភ្នំពេញ ទៅ ភ្នំដិន កាត់ តាម ក្រុង តាខ្មៅ និង ខេត្ត តាកែវ	5.291	48000	0308
khm_0308_3585113701.wav	នគរបាល ខណ្ឌ មានជ័យ ឃាត់ ខ្លួន ជន សង្ស័យ	4.608	48000	0308
khm_0308_3609071813.wav	កំពង់ ចំលង ភ្នំពេញ អរិយក្សត្រ	2.987	48000	0308
khm_0308_3609588942.wav	ជំនន់ ទន្លេ មេគង្គ គំរាមកំហែង ក្រុង កំពង់ចាម	4.523	48000	0308
khm_0308_3695887623.wav	នៅ មន្ទីរ ពេទ្យ ព្រះ កុសមៈ ក្រុង ភ្នំពេញ	3.669	48000	0308
khm_0308_3870807299.wav	ស្ពាន ព្រះ មុន្នីវង្ស ត្រូវ បាន កសាង ឡើយ នៅ ឆ្នាំ មួយ ពាន់ ប្រាំបួន រយ ម្ភៃ ប្រាំបី	6.4	48000	0308
khm_0308_3919765454.wav	ម៉ូតូ ពន្លះ ម៉ូតូ របួស បាក់ ជើង ម្ខាង នៅ ស្រុក ស្ទឹងហាវ	4.949	48000	0308
khm_0308_3932055739.wav	នៅ ស្តុប ទេព ផន បាក់ ដើម ក្ងោក ចំនួន ពីរ ដើម	4.011	48000	0308
khm_0308_3951045104.wav	លំផាត់ លំផាត់ ហ្នឹង ដូច ធ្លាប់ ឮ តែ មិន ដឹង នៅ ណា	4.181	48000	0308
khm_0308_4007043200.wav	ផ្ទុះសេ ខ្សែ ភ្លើង នៅ កុដិ ចៅអធិការ វត្ត សារាវន្ត	4.181	48000	0308
khm_0308_4076150523.wav	និស្សិត ទំនើង សាលា ន័រតុន ជិះ ម៉ូតូ បុក នគរបាល ចរាចរ របួស ជើង នៅ ស្តុប ផ្សារ ដីហុយ	7.253	48000	0308
khm_0308_4098931395.wav	សាកល វិទ្យាល័យ បញ្ញា ជាតិ លុប ចោល គម្រោង រៀបចំ ទិវា សិទ្ធិ នាទី អន្តរជាតិ	6.059	48000	0308
khm_0308_4100714932.wav	ពលរដ្ឋ ឫស្សីកែវ ខឹង នឹង ក្រុមហ៊ុន	3.157	48000	0308
khm_0308_4108805941.wav	ពលរដ្ឋ ខេត្ត កំពង់ស្ពឺ សម្រុក ដាំ ដើម ម្រុំ	3.925	48000	0308
khm_0308_4180620092.wav	សម្រាប់ និស្សិត រូល និង និស្សិត ដែល ទើប បញ្ចប់ ការ សិក្សា ថ្មី ថ្មី	4.779	48000	0308
khm_0308_4294439534.wav	រង្វង់មូល ច្រក ទ្វារ អន្តរជាតិ ប៉ោយប៉ែត តាំង លំអ ដោយ សំរាម គ្មាន សណ្ដាប់ធ្នាប់	6.741	48000	0308
khm_0877_0031761215.wav	ចុងឃ្នាស នៅ ជាប់ នឹង បឹង ទន្លេ សាប ក្នុង ប្រទេស កម្ពុជា	5.717	48000	0877
khm_0877_0162568467.wav	សាកល វិទ្យាល័យ បញ្ញាសាស្ដ្រ ធ្វើ បុណ្យ កតញ្ញូ ចំពោះ អ្នក មាន គុណ	7.68	48000	0877
khm_0877_0163875158.wav	ល្បែង កន្ទុយ លេខ កំពុង រីក ដូច ផ្សិត នៅ ក្រុង ខេមរភូមិន្ទ	5.888	48000	0877
khm_0877_0172384750.wav	តើ ភ្នំដា នៅ ខេត្ត ណា	3.584	48000	0877
khm_0877_0217032673.wav	ដើម្បី ស្វែងរក ការ គាំទ្រ ពី ប្រជា ពលរដ្ឋ នៅ តាម មូលដ្ឋាន ភូមិ ឃុំ របស់ ស្រុក បាធាយ	7.509	48000	0877
khm_0877_0227618637.wav	ភ្នំ តាម៉ៅ មាន កាំ ជណ្ដើរ ប៉ុន្មាន	4.437	48000	0877
khm_0877_0270274151.wav	នៅ សួន ច្បារ ទល់ មុខ សណ្ឋាគារ កាំបូឌីយ៉ាណា ក្រុង ភ្នំពេញ	5.632	48000	0877
khm_0877_0435354763.wav	យុវជន ផ្សេង ទៀត កំពុង លេង បាល់ទាត់ នៅ ក្បែរ ផ្ទះ របស់ ខ្លួន នៅ ភូមិ ជ្រោយ បាសាក់ សង្កាត់ ព្រែកប្រា ខេត្ត ច្បារអំពៅ	9.813	48000	0877
khm_0877_0491391921.wav	ពលរដ្ឋ ខ្មែរ ខេត្ត កំពង់ធំ នេសាទ ឈ្លើង លក់	4.949	48000	0877
khm_0877_0512987754.wav	គម្រោង នេះ នឹង អាច ចាប់ផ្តើម ជា ផ្លូវការ នៅ ពាក់កណ្ដាល ឆ្នាំ ពីរ ពាន់ ដប់ ប្រាំ	6.827	48000	0877
khm_0877_0514543577.wav	សាលា ក្រុង នឹង បិទ ផ្លូវ មួយចំនួន ក្បែរ ព្រះ បរមរាជវាំង បណ្ដោះអាសន្ន	6.144	48000	0877
khm_0877_0587890502.wav	ពពក វិល លើ ភ្នំ បូកគោ	4.011	48000	0877
khm_0877_0621524282.wav	ភ្នំ ស្រី ភ្នំ ប្រុស ជា រមណីយដ្ឋាន វប្បធម៌ ប្រវត្តិសាស្ត្រ	5.291	48000	0877
khm_0877_0693823517.wav	កង កម្លាំង រាជ អាវុធហត្ថ ខណ្ឌ ចំការមន ឃាត់ ខ្លួន ជន សង្ស័យ ពីរ នាក់ ជិះ ម៉ូតូ អត់ ស្លាក លេខ	8.704	48000	0877
khm_0877_0872623068.wav	មន្ត្រី អគ្គិសនី កម្ពុជា បាន ចាប់ផ្តើម ចុះ ត បណ្ដាញ អគ្គិសនី និង ដំឡើង កុងទ័រ ជូន កម្មករ កម្មការិនី នៅ ក្រុង ភ្នំពេញ	11.776	48000	0877
khm_0877_1009294136.wav	ជប៉ុន ធ្វើ គម្រោង ទេសចរណ៍ ប្លែក ប្លែក លើ ផ្ទៃ ដី ប្រាំពីរ រយ ហិកតា នៅ ឧទ្យាន គិរីរម្យ	8.619	48000	0877
khm_0877_1019126241.wav	ភ្លៀង មួយ មេ ព្រឹក មិញ អាជីវករ ផ្សារ អូឡាំពិក អង្គុយ បក់ រុយ ព្រោះ ទឹក លិច ពេញ ក្នុង ផ្សារ	7.68	48000	0877
khm_0877_1153487542.wav	វិហារ ឥស្លាម នៅ ខាង ត្បូង គល់ ស្ពាន ព្រែក តាមាក់ ត្រើយ ខាង លិច	5.717	48000	0877
khm_0877_1299917338.wav	ជំនន់ ទឹក ស្ទឹងសែន បាន ពន្លិច ភូមិ ស្រុក ស្ទើរ តែ ទាំង អស់	5.973	48000	0877
khm_0877_1309213422.wav	ទៅ កំពង់ចាម កាត់ តាម ស្ពាន ព្រែកក្ដាម ក៏ បាន ដែរ	5.12	48000	0877
khm_0877_1324429108.wav	ផ្ទះ ដែល ទើប នឹង ទិញ នៅ ក្នុង បុរី ប៉េងហួត នោះ មាន តម្លៃ ជាង ដប់ ម៉ឺន ដុល្លារ	7.253	48000	0877
khm_0877_1352099982.wav	បេន ឡាន មុខ រ៉ា រថភ្លើង ក្បែរ អគារ កាណាឌីយ៉ា	4.949	48000	0877
khm_0877_1384285609.wav	រង្វង់មូល កាំកូ អង់តែន ទួលគក	4.779	48000	0877
khm_0877_1541265349.wav	ចំការ ស្នេហ៍ បាន បើក ដំណើរការ ឱ្យ ភ្ញៀវ ជាតិ អន្តរជាតិ ចូល លំហែ កំសាន្ត កាលពី ខែ កញ្ញា ឆ្នាំ ពីរ ពាន់ ដប់ បី	11.008	48000	0877
khm_0877_1778151076.wav	ច្រក ព្រំ ដែន អូស្មាច់ បាន បើក ឡើង វិញ	6.229	48000	0877
khm_0877_1802697207.wav	តោះ ទៅ មើល ថ្ងៃ លិច នៅ ភ្នំបាខែង	3.925	48000	0877
khm_0877_1824826716.wav	បង្គោល ភ្លើង ជុំវិញ ផ្សារ សិរីសោភ័ណ ជា សំបុក ពីងពាង	6.144	48000	0877
khm_0877_1934850371.wav	នាយ ទុយ យំ ពី ទូត អាមេរិក រហូត ដល់ ផ្ទះ	4.949	48000	0877
khm_0877_2004293336.wav	ខ្ញុំ ទៅ ភ្នំពេញថ្មី តាម ផ្លូវ ហាណូយ	4.096	48000	0877
khm_0877_2024325069.wav	ផ្លូវ ជាតិ លេខ ប្រាំមួយ ពី ខេត្ត កំពង់ចាម ទៅ ខេត្ត សៀមរាប	5.461	48000	0877
khm_0877_2066898729.wav	ជន វិកល ចរឹត វាយ ជន ជាតិ ថៃ ម្នាក់ ស្លាប់ នៅ ក្រុង ខេមរភូមិន្ទ	6.144	48000	0877
khm_0877_2080133158.wav	ផលិតផល ម្រេច កំពត ឆ្នាំ ពីរ ពាន់ ដប់ ប្រាំ សម្រេច បាន ហុក សិប តោន	6.4	48000	0877
khm_0877_2151980558.wav	ផ្ទះ ជន ជាតិ ភាគ តិច នៅ បឹង យក្សឡោម	4.352	48000	0877
khm_0877_2268482471.wav	ជិះ ស៊ីក្លូ ទៅ ផ្សារ ថ្មី	3.413	48000	0877
khm_0877_2307469440.wav	សណ្ឋាគារ កាបូឌីយ៉ាណា គឺ ជា សណ្ឋាគារ ដ៏ ចំណាស់ ល្បីល្បាញ មួយ របស់ ប្រទេស កម្ពុជា	7.509	48000	0877
khm_0877_2313764479.wav	នគរ កម្ពុជា ឬ នគរ ចេនឡា ជា ទឹកដី ដែល ស្ថិត នៅ ខាង ជើង ល្បាក់ខោន	7.253	48000	0877
khm_0877_2374515713.wav	នៅ មុខ ផ្សារ អ្នកលឿង ត្រើយ ខាង កើត ចំនួន ពីរ កន្លែង ជាប់ ផ្លូវ ជាតិ លេខ មួយ	6.571	48000	0877
khm_0877_2407591070.wav	ដែន ជំរក សត្វ ព្រៃ ភ្នំ ឱរ៉ាល់ នៅ កំពង់ស្ពឺ	5.291	48000	0877
khm_0877_2426696084.wav	ពេល ល្ងាច ទៅ ដើរ លេង នៅ ផាប់ ស្ទ្រីត	5.888	48000	0877
khm_0877_2458175148.wav	ជន ជាតិ វៀតណាម ដែល រស់នៅ លើ ផ្ទះ បណ្ដែត ទឹក ជា ច្រើន ខ្នង ជាប់ កំពង់ ចម្លង អរិយក្សត្រ	7.68	48000	0877
khm_0877_2485368840.wav	ផ្លូវ ជាតិ លេខ ប្រាំពីរ ភូមិ ពោធិរោង លិច ឃុំ កោងកាង ស្រុក ពញ្ញា ក្រែក	6.229	48000	0877
khm_0877_2492442447.wav	សមត្ថកិច្ច ដេញ ចោរ រត់ មក ដល់ ផ្សារ ហេង លី	4.779	48000	0877
khm_0877_2532869639.wav	នៅ ក្នុង មជ្ឈមណ្ឌល គៀនឃ្លាំង	4.011	48000	0877
khm_0877_2533047819.wav	ព្រះ មហា ក្សត្រិយ ស៊ីសុវត្ថិ កុសមៈ	4.437	48000	0877
khm_0877_2648993693.wav	រូប ចម្លាក់ ហនុមាន ត្រូវ បាន លួច ពី ប្រាសាទ កោះកេរ ក្នុង ខេត្ត ព្រះវិហារ	7.168	48000	0877
khm_0877_2683639365.wav	អភិបាល ស្រុក មេសាង បាន ប្រាប់ កម្ពុជា ថ្មី ឱ្យ ដឹង ថា	5.376	48000	0877
khm_0877_2762025636.wav	រថយន្ត ពីរ គ្រឿង បុក គ្នា ពេញ ទំហឹង នៅ លើ ស្ពាន ជ្រោយចង្វា	5.803	48000	0877
khm_0877_2775545249.wav	ប្រាសាទ បាយ័ន ស្នាម ញញឹម អមតៈ	4.693	48000	0877
khm_0877_2838394077.wav	ប្រាសាទ អង្គរ វត្ត កសាង ឡើង នៅ សតវត្ស ទី ដប់ ពីរ	5.717	48000	0877
khm_0877_2880000612.wav	លោក យាយ មាន ទី លំនៅ ក្នុង ភូមិ ជើង ឡង ក្រុង សួង	5.205	48000	0877
khm_0877_2946427372.wav	តោះ ទៅ ជប់លៀង នៅ ព្រែកលៀប	3.669	48000	0877
khm_0877_2970152139.wav	ទូត អាមេរិក បន្ត អំពាវនាវ ឱ្យ មាន ការ ស្ងប់ស្ងាត់	5.035	48000	0877
khm_0877_3018247941.wav	កំពង់ធំ គឺ ជា ខេត្ត មួយ ដែល ស្ថិត នៅ ចំ កណ្ដាល ប្រទេស កម្ពុជា	6.571	48000	0877
khm_0877_3141299004.wav	រថយន្ត កូរ៉េ បុក រថយន្ត កាមរី ចំ ពាក់កណ្ដាល ស្តុប បូកគោ	5.632	48000	0877
khm_0877_3153158189.wav	បឹង យក្សឡោម កើត ឡើង ដោយសារ បន្ទុះ ភ្នំភ្លើង	5.12	48000	0877
khm_0877_3197301397.wav	ព្រះ មហា ក្សត្រិយ ស៊ីសុវត្ថិ កុសមៈ	4.437	48000	0877
khm_0877_3383266390.wav	សាលា រាជធានី ភ្នំពេញ គ្រោង ស្តារ អាង ស្ដុក ទឹក បឹងត្របែក ខាង ត្បូង និង ខាង ជើង	7.765	48000	0877
khm_0877_3450893542.wav	សមត្ថកិច្ច ចម្រុះ ឆែកឆេរ ខុនដូ នៅ បឹងត្របែក សង្ស័យ ពាក់ព័ន្ធ បទ ល្មើស គ្រឿង ញៀន	7.851	48000	0877
