filename	text	duration	sampling_rate	speaker
khm_1728_3600220731.wav	ខ្ញុំ ចង់ ញ៉ាំ អី នៅ ភោជនីយដ្ឋាន គុយទាវ ទូក តែ គ្មាន គ្នា ទៅ ជាមួយ	5.035	48000	1728
khm_1728_3633277862.wav	ជែកគី ចាន់ មាន ឈ្មោះ ហៅ ក្រៅ ថា ឈិន ឡុង	3.669	48000	1728
khm_1728_3688642437.wav	ក្រុមហ៊ុន ទឹក បរិសុទ្ធ វីតាល់ ចូលរួម ឧបត្ថម្ភ យុទ្ធនាការ សំអាត ឆ្នេរ	5.888	48000	1728
khm_1728_3754806581.wav	កោះ ត្រល់ មាន ចម្ងាយ សែសិប គីឡូ ម៉ែត្រ ពី ខេត្ត ហាទៀង របស់ វៀតណាម	5.803	48000	1728
khm_1728_3774021441.wav	ម៉ាជូពីជូ ជា ទីក្រុង បុរាណ នៃ ប្រទេស ប៉េរ៉ូ	4.352	48000	1728
khm_1728_3803205583.wav	ចម្រៀង របស់ រ៉ូប៊ីន លីមផម មួយ បទ ធ្វើ ឱ្យ អ្នក ស្ដាប់ ស្រក់ ទឹក ភ្នែក	5.035	48000	1728
khm_1728_3824743612.wav	ការ សម្ដែង របស់ លោក លី តាវហួ គួរ ឱ្យ ចាប់អារម្មណ៍	3.925	48000	1728
khm_1728_3825806355.wav	ក្រុមហ៊ុន ឆេរ៉ឺវ៉ុន បាន មក បណ្ដាក់ ទុន នៅ ឡាវ	3.755	48000	1728
khm_1728_3879839597.wav	ចិន សំបូរ រឿងរ៉ាវ ប្រវត្តិសាស្ត្រ	3.243	48000	1728
khm_1728_3896190215.wav	កីឡា ការិនី វាយ កូន បាល់ ថៃ ប្រកួត ចាញ់ កីឡា ការិនី មីយ៉ាន់ម៉ា	5.205	48000	1728
khm_1728_3903500049.wav	ការ សម្រេចចិត្ត ទៅ សិក្សា នៅ ប៊ុលហ្គារី ជា ការ សម្រេច ដ៏ ត្រឹមត្រូវ មួយ	5.632	48000	1728
khm_1728_3908585914.wav	កូកាកូឡា បាន ធ្វើការ ផ្សាយ ពាណិជ្ជ កម្ម ដោយ ដាក់ ឈ្មោះ អតិថិជន លើ កំប៉ុង	5.291	48000	1728
khm_1728_3940207553.wav	ក្រុមហ៊ុន វីរៈ ប៊ុនថាំ អ៊ិចប្រេស ដឹក អ្នក ដំណើរ ពី ភ្នំពេញ ទៅ កំពង់សោម	5.035	48000	1728
khm_1728_4071726487.wav	ក្រុម តារា សម្ដែង ខ្មែរ បាន ទៅ ទីក្រុង ញូវយ៉ក	3.84	48000	1728
khm_1728_4080874745.wav	ចោទ ថា របប របស់ បាសារ អាល់អាសាត មិន គោរព អាយុ ជីវិត មនុស្ស	6.571	48000	1728
khm_1728_4130627207.wav	កីឡា ការិនី កម្ពុជា ប្រកួត ចាញ់ កីឡា ការិនី ឥណ្ឌូនេស៊ី	5.035	48000	1728
khm_1728_4141694185.wav	កោះ សន្តិភាព ជា កាសែត ចេញ ផ្សាយ ប្រចាំ ថ្ងៃ ដ៏ ល្បី មួយ ក្នុង ប្រទេស កម្ពុជា	5.717	48000	1728
khm_1728_4151266683.wav	កុំកុំ ជា តារា ជើង ចាស់ ដែល មាន ក្បាច់ គុន ល្អ ជាង គេ	4.096	48000	1728
khm_1728_4194560404.wav	ឈិន ឡុង ជា តារា សម្ដែង របស់ ហូលីវូដ	3.499	48000	1728
khm_1728_4241354476.wav	ការ វះកាត់ ស្មា របស់ ខាន់ នៅ មន្ទីរ ពេទ្យ ក្រុង មុំ បៃ បាន ទទួល ជោគជ័យ	5.888	48000	1728
khm_2499_0001480462.wav	ប្រាក មាន បណ្ណាល័យ យ៉ាង ច្រើន សំរាប់ ប្រជា ពលរដ្ឋ	4.693	48000	2499
khm_2499_0023820615.wav	រិទ្ធ មុនី ជា ក្រុមហ៊ុន ដឹក អ្នក ដំណើរ ដែល មាន តម្លៃ សំបុត្រ សមរម្យ	5.12	48000	2499
khm_2499_0026552939.wav	សាលា បង្រៀន បើកបរ ដៃ ធំ ពីរ ជា សាលា បង្រៀន បើកបរ មុន គេ បង្អស់ ក្នុង ស្រុក ខ្មែរ	6.997	48000	2499
khm_2499_0029453534.wav	នំប៉័ង សៀវម៉ៃ នៅ ផ្សារ ដើមគ ឆ្ងាញ់ ផស់ គេ	4.267	48000	2499
khm_2499_0030968875.wav	លោក ថម គ្រូស ជា តារា សម្ដែង ដែល លេច ធ្លោ	3.669	48000	2499
khm_2499_0040518112.wav	អាតែន ដែល ជា វិទ្យាស្ថាន គរុ វិជ្ជា ជាន់ ខ្ពស់ ដំបូង បង្អស់ នៅ លោក ខាង លិច	6.144	48000	2499
khm_2499_0053899499.wav	អាបុត រង ការ រិះគន់ ពី អតិថិជន របស់ ខ្លួន	4.437	48000	2499
khm_2499_0092623092.wav	ប្រទេស អេក្វាឌ័រ បាន ព្យាយាម កាត់ បន្ថយ ការ កាប់ បំផ្លាញ ព្រៃឈើ	5.632	48000	2499
khm_2499_0100335283.wav	ហ្សែនចា ជា ក្រុមហ៊ុន ភេសជ្ជៈ ដែល នាំចូល ពី ប្រទេស ជប៉ុន	4.352	48000	2499
khm_2499_0105894105.wav	យីងឡាក់ ស៊ីនណាវ៉ាត្រា មិន មែន ជា ប្អូន របស់ លោក ប្រាយុទ្ធ ចាន់ អូចា	5.717	48000	2499
khm_2499_0107847460.wav	មិត្តភក្តិ របស់ ខ្ញុំ បាន ទៅ លេង ប្រទេស អេស្ប៉ាញ	3.84	48000	2499
khm_2499_0114690126.wav	ផ្សារ បាយ័ន ផ្តល់ ជូន នូវ ទំនិញ ដែល មាន គុណភាព ជា ច្រើន ប្រភេទ ក្នុង តម្លៃ ទាប	5.717	48000	2499
khm_2499_0131604804.wav	ធនាគារ ភូមិ សម្រេច បាន នូវ ការ ផ្តល់ សេវា ហិរញ្ញ វត្ថុ ដល់ អតិថិជន ក្រីក្រ	5.632	48000	2499
khm_2499_0144102773.wav	ពីរ៉ាមីត ជា ក្រុមហ៊ុន បកប្រែ ដ៏ ល្អ មួយ ក្នុង ប្រទេស កម្ពុជា	5.632	48000	2499
khm_2499_0154355316.wav	ការ អប់រំ នៅ អូរីហ្គន មាន ការ ទន់ខ្សោយ នៅ ឡើយ	3.925	48000	2499
khm_2499_0266581353.wav	បច្ចុប្បន្ន សណ្ឋាគារ ដែល ធំ ជាង គេ លើ លោក ស្ថិត នៅ ក្រុង ឡាសវេហ្គាស សហរដ្ឋ អាមេរិក	5.461	48000	2499
khm_2499_0271924772.wav	ភីហ្សា ខមភែនី បញ្ចុះ តម្លៃ ពិសេស	3.755	48000	2499
khm_2499_0274681042.wav	ស៊ី ធី វី ជា ប៉ុស្តិ៍ ទូរទស្សន៍ ខ្សែ កាប	4.011	48000	2499
khm_2499_0307839478.wav	សាលា ចំការ ដូង បណ្ដុះ គំនិត ឱ្យ និស្សិត ស្រលាញ់ វិស័យ កសិកម្ម	5.632	48000	2499
khm_2499_0311250531.wav	បែលហ្គ្រាដ មាន ចំណាប់ អារម្មណ៍ ក្នុង ការ បណ្ដាក់ទុន នៅ ប្រទេស មីយ៉ាន់ម៉ា	5.717	48000	2499
khm_2499_0340132288.wav	ម៉ាក ថ្វេន មិន បាន រៀបការ នៅ ចុង ខែ នេះ ទេ	3.84	48000	2499
khm_2499_0359379764.wav	មន្ទីរ ពេទ្យ ហ៊ូឡុង ដេប៉ូ ជា មន្ទីរ ពេទ្យ តែ មួយ គត់ ដែល ពិនិត្យ និង ព្យាបាល រោគ បុរស	6.571	48000	2499
khm_2499_0359578331.wav	បង់ក្លាដេស និង ប្រទេស ឈីលី សហការ គ្នា បង្កើន សេដ្ឋកិច្ច ជាតិ	5.035	48000	2499
khm_2499_0407048629.wav	មន្ទីរពេទ្យ ពេទ្យ វិសាល សុខ ជា មន្ទីរ ពេទ្យ ដែល ពិនិត្យ និង ព្យាបាល ជំងឺ ទូទៅ	6.144	48000	2499
khm_2499_0437795739.wav	សាលា ជ័យ ថា វី ជា សាលា បណ្តុះបណ្តាល សិស្ស សម្រាប់ ត្រៀម ប្រឡង យក អាហារូបករណ៍	6.656	48000	2499
khm_2499_0438352758.wav	ន ស ពីរ រ ជា ហាង តែ បៃតង ទឹក ដោះ គោ និង ហាង នំ	4.949	48000	2499
khm_2499_0454012734.wav	វាំង បាក់ឃីងហ៊ែម មាន អាកាសធាតុ ក្តៅ ហែង	4.864	48000	2499
khm_2499_0472220743.wav	ពិភព លោក អាច ស្អប់ ហាស្សាន រូហានី តែ អ្វី អ្វី ដែល គាត់ ធ្វើ គឺ ដើម្បី ប្រទេស ជាតិ គាត់ ដូច អូបាម៉ា ធ្វើ ដើម្បី អាមេរិក ដែរ	9.557	48000	2499
khm_2499_0485443580.wav	យើង អាច មើល វីដេអូ អ្វី ក៏ បាន នៅ លើ យូធូប	4.352	48000	2499
khm_2499_0499620394.wav	ណាន យ៉ាង មាន តារា សម្ដែង ជា ច្រើន	3.072	48000	2499
khm_2499_0506599604.wav	លួង ព្រះ បាង ជា ខេត្ត មួយ នៅ ប្រទេស ថៃ	3.84	48000	2499
khm_2499_0529944696.wav	ផលិតកម្ម ថោន ប្រជុំ ទៅ ដោយ តារា ល្បី ល្បី	4.181	48000	2499
khm_2499_0533250213.wav	មាន តារា ហូលីវូដ ម្នាក់ មុខ ដូច នែលសុន ម៉ាន់ដេឡា បេះ បិទ	5.12	48000	2499
khm_2499_0550815177.wav	មន្ទីរ ពេទ្យ សង់ត្រាល់ ជា មន្ទីរ ពេទ្យ ក្នុង ស្រុក ប៉ុន្តែ បាន បំពាក់ ទៅ ដោយ ម៉ាស៊ីន ព្យាបាល ទំនើប គុណភាព ខ្ពស់	8.533	48000	2499
khm_2499_0552965082.wav	កុំព្យូទ័រ ម៉ាក ឌែល មាន តម្លៃ សមរម្យ ហើយ ប្រើ បាន ដូច គេ ដូច ឯង ដែរ	5.461	48000	2499
khm_2499_0566497742.wav	សាក់ឡូ ជា តារា កំប្លែង ដ៏ ល្បី មួយ រូប	4.096	48000	2499
khm_2499_0582184388.wav	ប្រជា ជន នៅ ឡូសអាន់ជើលែស មាន ភាព ស៊ីវិល័យ	4.267	48000	2499
khm_2499_0583651303.wav	តួកគី ជា ប្រទេស ដែល មាន ដើម ឈើ ច្រើន ណាស់	4.011	48000	2499
khm_2499_0593441139.wav	លោក ដូណាល់ ត្រាម បាន ប្រជែង យក តំណែង ប្រធានាធិបតី អាមេរិក	5.632	48000	2499
khm_2499_0595706576.wav	ប៊ីង ជា ផែនទី អនឡាញ តែ មិន សូវ ពេញ និយម នៅ កម្ពុជា ទេ	5.547	48000	2499
khm_2499_0626619288.wav	មិន ដែល បាន ធ្វើ អ្វី ជាក់លាក់ សោះ តែ ចុង ក្រោយ ម៉ាក ថ្វេន ក្លាយ ជា ទស្សនៈ វិទូ ដ៏ គួរ ឱ្យ គោរព	7.509	48000	2499
khm_2499_0630295555.wav	នៅ វ៉ាស៊ីនតោន មាន ប្រជា ជន រស់នៅ ជាង ប្រាំពីរ លាន នាក់	4.864	48000	2499
khm_2499_0655600236.wav	មនុស្ស ដប់ ប្រាំ លាន នាក់ បាន ចូល ផ្សារ អ៊ីអន ក្នុង រយៈ ពេល មួយ ឆ្នាំ កន្លង មក នេះ	5.547	48000	2499
khm_2499_0675105590.wav	ទីក្រុង ប៊ុមបៃ នៃ ប្រទេស ឥណ្ឌា ត្រូវ បាន កែប្រែ មក ជា មុំបៃ	5.291	48000	2499
khm_2499_0694542708.wav	ស៊ី ធី អិន ជា ប៉ុស្តិ៍ ទូរទស្សន៍ ដែល នាំ មុខ គេ ក្នុង ប្រទេស កម្ពុជា	5.632	48000	2499
khm_2499_0709191589.wav	សាលា លីម កុកវីង ជា សាលា អន្តរជាតិ	5.461	48000	2499
khm_2499_0728203256.wav	សាលា អាលីយ៉ង់ មាន បង្រៀន ភាសា បារាំង	4.437	48000	2499
khm_2499_0745940205.wav	ភោជនីយដ្ឋាន ម្លិះ មាន តម្លៃ សមរម្យ និង អាហារ មាន រសជាតិ ឆ្ងាញ់	6.4	48000	2499
khm_2499_0767663804.wav	ម៉ាក សែនសូនីតា គឺ ជា តារា សម្ដែង ដែល កំពុង លេច ធ្លោ ក្នុង ស្រទាប់ យុវវ័យ	6.741	48000	2499
khm_2499_0778080929.wav	ម៉ូតូរ៉ូឡា ជា ក្រុមហ៊ុន ទូរសព្ទ របស់ ប្រទេស កូរ៉េ ខាង ត្បូង	5.12	48000	2499
khm_2499_0796238706.wav	មែសស៊ី ទទួល រង នូវ កា រិះគន់ ពី ប្រទេស ជិត ខាង នានា	5.035	48000	2499
khm_2499_0809550716.wav	លី សាវឡុង កើត នៅ ចិន តែ ទៅ រស់នៅ អាមេរិក	4.437	48000	2499
khm_2499_0823907156.wav	យើង អាច ស្វែងរក ព័ត៌មាន អ្វី ក៏ បាន តាម រយៈ គេហទំព័រ ហ្គូហ្គល	5.717	48000	2499
khm_2499_0833781420.wav	មូលហេតុ អ្វី ខ្លះ ធ្វើ ឱ្យ វិគីភីឌា មិន សរសេរ អំពី អ៊ីហាប បាដាវី	5.803	48000	2499
khm_2499_0856362704.wav	សាយហ្គន មាន ប្រជា ជន រស់នៅ ច្រើន ជាង គេ នៅ វៀតណាម	4.608	48000	2499
khm_2499_0862531836.wav	ភោជនីយដ្ឋាន ដាវ កាហ្វេ មាន សេវា ដឹក ជញ្ជូន ដល់ គេហដ្ឋាន	5.12	48000	2499
khm_2499_0871223882.wav	ម៉ាលីយ៉ា ជា មន្ទីរ ពេទ្យ ឯកទេស រោគ ស្ត្រី	5.547	48000	2499
khm_2499_0900792502.wav	ស្ថានីយ៍ ទូរទស្សន៍ បាយ័ន មាន កម្មវិធី ប្លែក ប្លែក ច្រើន	4.523	48000	2499
khm_2499_0916908064.wav	សៀងហៃ ជា ខេត្ត មួយ នៃ ប្រទេស ចិន	3.499	48000	2499
khm_2499_0936957842.wav	ស្ងាត់ ស្ងាត់ នាយ ចឺម ចូល សាន់ដេ ដាក់ មួយ បទ ពីរោះ មែន ទែន	5.035	48000	2499
khm_2499_0957188437.wav	លោក លី ក្វាន់យូ ជា មនុស្ស ដែល មាន ទឹកចិត្ត តស៊ូ	4.693	48000	2499
khm_2499_0957484342.wav	ណាប៉ូឡេអុង មាន មហិច្ឆតា ចង់ វាតទី ពង្រីក អំណាច របស់ បារាំង ឱ្យ បាន កាន់តែ ធំ ថែម ទៀត	6.315	48000	2499
khm_2499_0974292327.wav	អេច្ឆ ធី ស៊ី បាន ខាតបង់ ថវិកា ជា រៀងរាល់ ឆ្នាំ	4.352	48000	2499
khm_2499_0977337690.wav	កូឡុំបូ ជា ប្រទេស ផលិត សៀវភៅ សរសេរ ដៃ ដំបូង គេ បង្អស់	4.693	48000	2499
khm_2499_1000635673.wav	លោក លី ក្វាន់យូ បាន អភិវឌ្ឍ ប្រទេស សិង្ហបុរី ពី បាត ដៃ ទទេ	5.632	48000	2499
khm_2499_1006359266.wav	យន្តហោះ ប៊ូអ៊ីង បាន ធ្លាក់ នៅ ប៉ាគីស្តាន	3.499	48000	2499
khm_2499_1008361211.wav	លីណូវ៉ូ រចនា កុំព្យូទ័រ ដោយ ការ ច្នៃប្រឌិត ខ្ពស់	4.523	48000	2499
khm_2499_1012989395.wav	មន្ទីរ ពេទ្យ ហ៊ូឡុង ដេប៉ូ ពិនិត្យ ជំងឺ ឥត គិត ថ្ងៃ សម្រាប់ ជន ក្រីក្រ	6.059	48000	2499
khm_2499_1046036248.wav	ផ្សារ សុវណ្ណា មាន ការ រចនា ហាង បែប ថ្មី ទំនើប	4.523	48000	2499
khm_2499_1057257627.wav	ម៉ាស្ទ័រ ស៊ុគីស៊ុប និង ម៉ាស្ទ័រ គ្រីល ត្រូវការ ជ្រើសរើស បុគ្គលិក ជា ច្រើន នាក់ សំរាប់ សាខា បើក ថ្មី	7.765	48000	2499
khm_2499_1058133150.wav	លន់ នល់ បាន លាលែង ពី តំណែង និង និរទេស ខ្លួន ទៅ កាន់ រដ្ឋ ហាវ៉ៃ	5.547	48000	2499
khm_2499_1063775538.wav	សប្បាយ គឺ ជា គេហទំព័រ ផ្តល់ ព័ត៌មាន និង ព្រឹត្តិការណ៍ ផ្សេង ផ្សេង	5.547	48000	2499
khm_2499_1070570551.wav	ប្រទេស ប៉ូឡូញ ជា ប្រទេស មួយ នៅ អឺរ៉ុប	4.011	48000	2499
khm_2499_1087650036.wav	មន្ទីរ ពេទ្យ បាយ័ន នៅ ជាប់ នឹង ស្ពាន អាកាស ក្បាល ថ្នល់	5.035	48000	2499
khm_2499_1118548535.wav	រ៉ូម ជា ទីក្រុង ដ៏ ចំណាស់ របស់ ប្រទេស អ៊ីតាលី	4.949	48000	2499
khm_2499_1129376051.wav	ថម គ្រូស ជា តារា សម្ដែង ហូលីវូដ ដែល រក ចំណូល បាន ច្រើន ជាង គេ	5.291	48000	2499
khm_2499_1137492942.wav	ម៉ាកាវ ជា ខេត្ត ដែល សំបូរ អ្នក ទៅ លេង ច្រើន	4.267	48000	2499
khm_2499_1176020200.wav	ប្រជា ជន កម្ពុជា ភាគ តិច ណាស់ ដែល អាច មាន លទ្ធភាព ទិញ រថយន្ត ម៉ាក ប៊ី អឹម ដាប់បិលយូ	6.571	48000	2499
khm_2499_1185199981.wav	អាតែន ជា តំបន់ ដែល សំបូរ ដោយ ធ្យូង ថ្ម	4.949	48000	2499
khm_2499_1190085424.wav	វីអេណា មាន តំបន់ ប្រវត្តិសាស្ត្រ ជា ច្រើន	4.181	48000	2499
khm_2499_1201768938.wav	មហាត្មៈគន្ធី បាន អប់រំ មនុស្ស ឱ្យ ប្រើ តែ កម្លាំង ប្រាជ្ញា ជា ជាង យក កំហឹង ទល់ កំហល់	7.424	48000	2499
khm_2499_1207246518.wav	រីករាយ ជាមួយ នឹង ការ ជាវ ទំនិញ ដោយ ទទួល បាន ការ បញ្ចុះ តម្លៃ នៅ ឆាយ ហុក កុំព្យូទ័រ	7.253	48000	2499
khm_2499_1249741091.wav	ន ស ពីរ រ ហាង តែ បៃតង ដែល ពេញ និយម សម្រាប់ យុវវ័យ	4.693	48000	2499
khm_2499_1279884367.wav	ថេន សេន ហាត់ប្រាណ សាប សិប នាទី ជា រៀងរាល់ ថ្ងៃ	4.096	48000	2499
khm_2499_1341141492.wav	នេះ ជា ស្ពាន ផ្លូវ ដែក ទ្រុឌទ្រោម ដែល បាន បន្សល់ ទុក ពី សម័យ អាណានិគម បារាំង	5.632	48000	2499
khm_2499_1359902572.wav	ឥណ្ឌូនេស៊ី ជា ប្រទេស ស្ថាបនិក និង ដឹកនាំ រដ្ឋាភិបាល អាស៊ាន ដំបូង គេ បង្អស់	11.008	48000	2499
khm_2499_1391912302.wav	ផេផាល់ ជា ប្រព័ន្ធ បង់ ប្រាក់ តាម អនឡាញ ដែល មាន សុវត្ថិភាព បំផុត	5.461	48000	2499
khm_2499_1393515863.wav	ទឹក បរិសុទ្ធ ហាយ តិច មាន តម្លៃ សមរម្យ និង គុណភាព ខ្ពស់	4.779	48000	2499
khm_2499_1417301176.wav	មហាម៉ាត់ អាលី មាន ទេពកោសល្យ ក្នុង វិស័យ សិល្បៈ	5.035	48000	2499
khm_2499_1464162194.wav	រថយន្ត ដឹក ស្រាបៀរ អាន់ឆ័រ បុក ម៉ូតូ កល់ ជាប់ ក្រោម រថយន្ត នៅ ក្រុង បានលុង	6.656	48000	2499
khm_2499_1478195045.wav	ម៉ៃ ថៃសាន់ បាន ចូលរួម សម្ដែង រឿង ហូលីវូដ	4.181	48000	2499
khm_2499_1516539312.wav	ធនាគារ កាណាឌីយ៉ា គឺ ជា ធនាគារ ដែល ផ្តល់ សេវាកម្ម បាន យ៉ាង ល្អ	5.888	48000	2499
khm_2499_1533926493.wav	លុច ស៊ីស ជា ប្រភេទ រថយន្ត ទំនើប និង ទាន់ សម័យ	5.205	48000	2499
khm_2499_1599531556.wav	លី ស៊ាវឡុង មាន ឈ្មោះ ពិត ថា ប៊្រូស លី ត្រូវ បាន គេ ឃើញ មាន ឈ្មោះ មក ប្រលង បាក់ឌុប ឆ្នាំ នេះ	6.741	48000	2499
khm_2499_1636750016.wav	ប្រទះ ឃើញ រថយន្ត ស៊េរី ទំនើប ប្លុង ចោល នៅ មុខ ហាង នំប៉័ង បាយ័ន	5.888	48000	2499
khm_2499_1650435929.wav	អ៊ីស្រាអែល ស្នើ ឱ្យ មាន ការ ចរចា សន្តិភាព ជាមួយ ប៉ាឡេស្ទីន	5.035	48000	2499
khm_2499_1655258392.wav	មាន តែ សេដ្ឋី ទេ ទើប អាច ជិះ ឡាន ម៉ាក ហ្វេរ៉ារី បាន	4.864	48000	2499
khm_2499_1662881294.wav	លែនរ៉ូវើ អាច បើកបរ ផ្លូវ ឆ្ងាយ បាន ដោយ ត្រជាក់ ចិត្ត	4.949	48000	2499
khm_2499_1664025279.wav	វ៉ារេន ប៊ូហ្វេត ជំនាញ ខាង ភាគហ៊ុន	3.669	48000	2499
khm_2499_1670585953.wav	អ៊ីហ្ស៊ីខម ជា ក្រុមហ៊ុន អ៊ីនធឺណិត ដ៏ ល្អ ក្នុង ប្រទេស កម្ពុជា	4.779	48000	2499
khm_2499_1688623043.wav	អ៊ីនធែល ក៏ មាន លក់ គ្រឿង បន្លាស់ សម្រាប់ កុំព្យូទ័រ ដែរ	4.779	48000	2499
khm_2499_1729792597.wav	វៀតណាម សំបូរ ត្រី និង បន្លែ	3.072	48000	2499
khm_2499_1744695413.wav	ពិធី បុណ្យ ខួប លើក ទី ហា សិប បួន នៃ ការ បង្កើត សាលា ភូមិន្ទ រដ្ឋបាល	5.803	48000	2499
khm_2499_1756210647.wav	ការ ព្យាបាល មិន គិត ថ្លៃ ផ្នែក ភ្នែក នៅ មន្ទីរ ពេទ្យ ព្រះ កេតុមាលា	5.205	48000	2499
khm_2499_1776900649.wav	រដ្ឋាភិបាល ភូមា រឹត បន្តឹង មង្គលការ នៃ សហគមន៍ រ៉ូហ៊ីងយ៉ា ភូមា	6.656	48000	2499
khm_2499_1794245687.wav	មហាម៉ាត់ អាលី ប្រដាល់ មិន ដែល ចាញ់	3.925	48000	2499
khm_2499_1795733517.wav	ប្រទេស ម៉ុងហ្គោលី មាន ព្រំ ប្រទល់ ជាប់ នឹង ប្រទេស ចិន	4.693	48000	2499
khm_2499_1803866358.wav	ពួក យើង ចូលចិត្ត នាឡិកា ប៊ីកប៊ែន	3.413	48000	2499
khm_2499_1861218998.wav	ចាក់ សាំង សូគីម៉ិច ពីរ លីត្រ បាន នំ ស្រួយ លីលី មួយ កញ្ចប់	4.864	48000	2499
khm_2499_1863710018.wav	លីង អ៊ីន ជា បណ្ដាញ សង្គម ដែល ល្អ ជាង ហ្វេសប៊ុក	4.267	48000	2499
khm_2499_1873802056.wav	ហ៊ីត្លែរ និង ការ បង្កើត គណបក្ស ណាស៊ី នៅ អាល្លឺម៉ង់ ដើម្បី ត្រួតត្រា ឆេកូ	5.632	48000	2499
khm_2499_1923953643.wav	ភោជនីយដ្ឋាន ផ្ទះ ម៉ែ ក្មេក មាន លក់ ម្ហូប វៀតណាម និង ម្ហូប ចិន	5.205	48000	2499
